{
  "schemaVersion": "1.0.0",
  "id": "01J9M0000000000000000CH3",
  "rootId": "01J8Z0000000000000000RT1",
  "anchorMsgId": "01J8Z00000000000000MSG60",
  "kind": "CHAPTER",
  "label": "Getting defensive again",
  "note": "User's phrasing here drifts toward the same hedging pattern as three sessions ago — possible idiolect shift, worth a self-observation pass.",
  "at": "2026-08-11T12:00:00Z",
  "source": "SYSTEM",
  "unknownFields": {}
}
